{
  "$schema": "http://json-schema.org/draft-07/schema#",
  "$id": "https://raw.githubusercontent.com/suirindo/agent-role-contracts/v0.1.0/schemas/handoff.schema.json",
  "title": "Agent Role Contracts handoff",
  "type": "object",
  "additionalProperties": false,
  "required": [
    "schema_version",
    "task_id",
    "from_agent",
    "suggested_next_agent",
    "current_status",
    "objective",
    "completed",
    "evidence",
    "decisions",
    "risks",
    "unresolved",
    "required_next_action",
    "confidence"
  ],
  "properties": {
    "schema_version": {
      "type": "string",
      "const": "0.1"
    },
    "task_id": {
      "type": "string",
      "pattern": "^[a-z0-9][a-z0-9._-]*$",
      "minLength": 1,
      "maxLength": 96
    },
    "from_agent": {
      "type": "string",
      "pattern": "^[a-z0-9][a-z0-9._-]*$",
      "minLength": 1,
      "maxLength": 96
    },
    "suggested_next_agent": {
      "type": "string",
      "pattern": "^[a-z0-9][a-z0-9._-]*$",
      "minLength": 1,
      "maxLength": 96
    },
    "current_status": {
      "type": "string",
      "enum": [
        "in_progress",
        "blocked",
        "ready_for_review",
        "complete"
      ]
    },
    "objective": {
      "type": "string",
      "minLength": 1,
      "pattern": "\\S"
    },
    "completed": {
      "type": "array",
      "items": {
        "type": "string",
        "minLength": 1,
        "pattern": "\\S"
      },
      "minItems": 0,
      "maxItems": 256,
      "uniqueItems": true
    },
    "evidence": {
      "type": "array",
      "items": {
        "type": "object",
        "additionalProperties": false,
        "required": [
          "result"
        ],
        "properties": {
          "file": {
            "type": "string",
            "minLength": 1,
            "pattern": "\\S"
          },
          "command": {
            "type": "string",
            "minLength": 1,
            "pattern": "\\S"
          },
          "result": {
            "type": "string",
            "minLength": 1,
            "pattern": "\\S"
          }
        }
      },
      "minItems": 1,
      "maxItems": 128,
      "uniqueItems": true
    },
    "decisions": {
      "type": "array",
      "items": {
        "type": "string",
        "minLength": 1,
        "pattern": "\\S"
      },
      "minItems": 0,
      "maxItems": 256,
      "uniqueItems": true
    },
    "risks": {
      "type": "array",
      "items": {
        "type": "string",
        "minLength": 1,
        "pattern": "\\S"
      },
      "minItems": 0,
      "maxItems": 256,
      "uniqueItems": true
    },
    "unresolved": {
      "type": "array",
      "items": {
        "type": "string",
        "minLength": 1,
        "pattern": "\\S"
      },
      "minItems": 0,
      "maxItems": 256,
      "uniqueItems": true
    },
    "required_next_action": {
      "type": "string",
      "minLength": 1,
      "pattern": "\\S"
    },
    "confidence": {
      "type": "number",
      "minimum": 0,
      "maximum": 1
    },
    "extensions": {
      "type": "object",
      "additionalProperties": true,
      "properties": {}
    }
  }
}
